{
  "$schema": "https://json-schema.org/draft/2020-12/schema",
  "$id": "https://example.invalid/gui-shell/schemas/permission.schema.json",
  "title": "許可（Permission）",
  "type": "object",
  "required": [
    "permission_id",
    "runtime_id",
    "capability_id",
    "operation",
    "target_scope",
    "scope",
    "decision",
    "source"
  ],
  "additionalProperties": false,
  "properties": {
    "permission_id": {
      "type": "string",
      "minLength": 1
    },
    "runtime_id": {
      "type": "string",
      "minLength": 1
    },
    "capability_id": {
      "type": "string",
      "minLength": 1
    },
    "operation": {
      "type": "string",
      "minLength": 1
    },
    "target_scope": {
      "type": "string",
      "minLength": 1
    },
    "scope": {
      "type": "string",
      "enum": [
        "operation",
        "target",
        "session",
        "time_window",
        "global"
      ]
    },
    "decision": {
      "type": "string",
      "enum": [
        "deny",
        "ask",
        "allow"
      ]
    },
    "source": {
      "type": "string",
      "enum": [
        "user",
        "policy",
        "runtime",
        "system_default"
      ]
    },
    "expires_at": {
      "type": [
        "string",
        "null"
      ],
      "format": "date-time"
    },
    "constraints": {
      "type": "object",
      "additionalProperties": true
    }
  }
}
